{
  "event_id": "event-draw-001",
  "instrument_id": "loan-001",
  "account_id": "account-credit-001",
  "relationship_id": "rel-synthetic-001",
  "legal_entity_id": "entity-bank-holdco",
  "line_of_business_id": "commercial-banking",
  "event_time": "2026-04-24T14:30:00Z",
  "event_type": "draw",
  "delta_balance": 250000.0,
  "delta_exposure": 250000.0,
  "delta_fee": 125.0,
  "attributes": {"channel": "treasury_portal"}
}
